
*** Running vivado
    with args -log lab2.vdi -applog -m64 -product Vivado -messageDb vivado.pb -mode batch -source lab2.tcl -notrace



****** Vivado v2023.1 (64-bit)
  **** SW Build 3865809 on Sun May  7 15:05:29 MDT 2023
  **** IP Build 3864474 on Sun May  7 20:36:21 MDT 2023
  **** SharedData Build 3865790 on Sun May 07 13:33:03 MDT 2023
    ** Copyright 1986-2022 Xilinx, Inc. All Rights Reserved.
    ** Copyright 2022-2023 Advanced Micro Devices, Inc. All Rights Reserved.

source lab2.tcl -notrace
Command: link_design -top lab2 -part xc7a35tcpg236-1
Design is defaulting to srcset: sources_1
Design is defaulting to constrset: constrs_1
INFO: [Device 21-403] Loading part xc7a35tcpg236-1
Netlist sorting complete. Time (s): cpu = 00:00:00 ; elapsed = 00:00:00 . Memory (MB): peak = 2318.133 ; gain = 0.000
INFO: [Netlist 29-17] Analyzing 18 Unisim elements for replacement
INFO: [Netlist 29-28] Unisim Transformation completed in 0 CPU seconds
INFO: [Project 1-479] Netlist was created with Vivado 2023.1
INFO: [Project 1-570] Preparing netlist for logic optimization
Parsing XDC File [C:/Users/usuario_local/Downloads/DAS_labs/source/lab2/lab2.xdc]
Finished Parsing XDC File [C:/Users/usuario_local/Downloads/DAS_labs/source/lab2/lab2.xdc]
INFO: [Opt 31-138] Pushed 0 inverter(s) to 0 load pin(s).
Netlist sorting complete. Time (s): cpu = 00:00:00 ; elapsed = 00:00:00 . Memory (MB): peak = 2450.449 ; gain = 0.000
INFO: [Project 1-111] Unisim Transformation Summary:
No Unisim elements were transformed.

7 Infos, 0 Warnings, 0 Critical Warnings and 0 Errors encountered.
link_design completed successfully
link_design: Time (s): cpu = 00:00:03 ; elapsed = 00:00:15 . Memory (MB): peak = 2454.449 ; gain = 536.406
Command: opt_design
Attempting to get a license for feature 'Implementation' and/or device 'xc7a35t'
INFO: [Common 17-349] Got license for feature 'Implementation' and/or device 'xc7a35t'
Running DRC as a precondition to command opt_design

Starting DRC Task
INFO: [DRC 23-27] Running DRC with 2 threads
INFO: [Project 1-461] DRC finished with 0 Errors
INFO: [Project 1-462] Please refer to the DRC report (report_drc) for more information.

Time (s): cpu = 00:00:01 ; elapsed = 00:00:00.442 . Memory (MB): peak = 2474.422 ; gain = 19.973

Starting Cache Timing Information Task
INFO: [Timing 38-35] Done setting XDC timing constraints.
Ending Cache Timing Information Task | Checksum: fe7b34be

Time (s): cpu = 00:00:03 ; elapsed = 00:00:04 . Memory (MB): peak = 3024.051 ; gain = 549.629

Starting Logic Optimization Task

Phase 1 Retarget
INFO: [Opt 31-138] Pushed 0 inverter(s) to 0 load pin(s).
INFO: [Opt 31-49] Retargeted 0 cell(s).
Phase 1 Retarget | Checksum: fe7b34be

Time (s): cpu = 00:00:00 ; elapsed = 00:00:00.009 . Memory (MB): peak = 3374.648 ; gain = 0.000
INFO: [Opt 31-389] Phase Retarget created 0 cells and removed 0 cells

Phase 2 Constant propagation
INFO: [Opt 31-138] Pushed 0 inverter(s) to 0 load pin(s).
Phase 2 Constant propagation | Checksum: fe7b34be

Time (s): cpu = 00:00:00 ; elapsed = 00:00:00.010 . Memory (MB): peak = 3374.648 ; gain = 0.000
INFO: [Opt 31-389] Phase Constant propagation created 0 cells and removed 0 cells

Phase 3 Sweep
Phase 3 Sweep | Checksum: 14a799517

Time (s): cpu = 00:00:00 ; elapsed = 00:00:00.012 . Memory (MB): peak = 3374.648 ; gain = 0.000
INFO: [Opt 31-389] Phase Sweep created 0 cells and removed 0 cells

Phase 4 BUFG optimization
Phase 4 BUFG optimization | Checksum: 14a799517

Time (s): cpu = 00:00:00 ; elapsed = 00:00:00.027 . Memory (MB): peak = 3374.648 ; gain = 0.000
INFO: [Opt 31-662] Phase BUFG optimization created 0 cells of which 0 are BUFGs and removed 0 cells.

Phase 5 Shift Register Optimization
INFO: [Opt 31-1064] SRL Remap converted 0 SRLs to 0 registers and converted 0 registers of register chains to 0 SRLs
Phase 5 Shift Register Optimization | Checksum: 131cb76fb

Time (s): cpu = 00:00:00 ; elapsed = 00:00:00.033 . Memory (MB): peak = 3374.648 ; gain = 0.000
INFO: [Opt 31-389] Phase Shift Register Optimization created 0 cells and removed 0 cells

Phase 6 Post Processing Netlist
Phase 6 Post Processing Netlist | Checksum: 131cb76fb

Time (s): cpu = 00:00:00 ; elapsed = 00:00:00.034 . Memory (MB): peak = 3374.648 ; gain = 0.000
INFO: [Opt 31-389] Phase Post Processing Netlist created 0 cells and removed 0 cells
Opt_design Change Summary
=========================


-------------------------------------------------------------------------------------------------------------------------
|  Phase                        |  #Cells created  |  #Cells Removed  |  #Constrained objects preventing optimizations  |
-------------------------------------------------------------------------------------------------------------------------
|  Retarget                     |               0  |               0  |                                              0  |
|  Constant propagation         |               0  |               0  |                                              0  |
|  Sweep                        |               0  |               0  |                                              0  |
|  BUFG optimization            |               0  |               0  |                                              0  |
|  Shift Register Optimization  |               0  |               0  |                                              0  |
|  Post Processing Netlist      |               0  |               0  |                                              0  |
-------------------------------------------------------------------------------------------------------------------------



Starting Connectivity Check Task

Time (s): cpu = 00:00:00 ; elapsed = 00:00:00.001 . Memory (MB): peak = 3374.648 ; gain = 0.000
Ending Logic Optimization Task | Checksum: 131cb76fb

Time (s): cpu = 00:00:00 ; elapsed = 00:00:00.035 . Memory (MB): peak = 3374.648 ; gain = 0.000

Starting Power Optimization Task
INFO: [Pwropt 34-132] Skipping clock gating for clocks with a period < 2.00 ns.
Ending Power Optimization Task | Checksum: 131cb76fb

Time (s): cpu = 00:00:00 ; elapsed = 00:00:00.004 . Memory (MB): peak = 3374.648 ; gain = 0.000

Starting Final Cleanup Task
Ending Final Cleanup Task | Checksum: 131cb76fb

Time (s): cpu = 00:00:00 ; elapsed = 00:00:00 . Memory (MB): peak = 3374.648 ; gain = 0.000

Starting Netlist Obfuscation Task
Netlist sorting complete. Time (s): cpu = 00:00:00 ; elapsed = 00:00:00 . Memory (MB): peak = 3374.648 ; gain = 0.000
Ending Netlist Obfuscation Task | Checksum: 131cb76fb

Time (s): cpu = 00:00:00 ; elapsed = 00:00:00.001 . Memory (MB): peak = 3374.648 ; gain = 0.000
INFO: [Common 17-83] Releasing license: Implementation
24 Infos, 0 Warnings, 0 Critical Warnings and 0 Errors encountered.
opt_design completed successfully
opt_design: Time (s): cpu = 00:00:06 ; elapsed = 00:00:06 . Memory (MB): peak = 3374.648 ; gain = 920.199
INFO: [runtcl-4] Executing : report_drc -file lab2_drc_opted.rpt -pb lab2_drc_opted.pb -rpx lab2_drc_opted.rpx
Command: report_drc -file lab2_drc_opted.rpt -pb lab2_drc_opted.pb -rpx lab2_drc_opted.rpx
INFO: [IP_Flow 19-234] Refreshing IP repositories
INFO: [IP_Flow 19-1704] No user IP repositories specified
INFO: [IP_Flow 19-2313] Loaded Vivado IP repository 'C:/software/electronica/xilinx/Vivado/2023.1/data/ip'.
INFO: [DRC 23-27] Running DRC with 2 threads
INFO: [Vivado_Tcl 2-168] The results of DRC are in file C:/Users/usuario_local/Downloads/DAS_labs/projects/lab2/lab2/lab2.runs/impl_1/lab2_drc_opted.rpt.
report_drc completed successfully
INFO: [Timing 38-480] Writing timing data to binary archive.
Writing XDEF routing.
Writing XDEF routing logical nets.
Writing XDEF routing special nets.
Write XDEF Complete: Time (s): cpu = 00:00:00 ; elapsed = 00:00:00.016 . Memory (MB): peak = 3374.648 ; gain = 0.000
INFO: [Common 17-1381] The checkpoint 'C:/Users/usuario_local/Downloads/DAS_labs/projects/lab2/lab2/lab2.runs/impl_1/lab2_opt.dcp' has been generated.
Command: place_design
Attempting to get a license for feature 'Implementation' and/or device 'xc7a35t'
INFO: [Common 17-349] Got license for feature 'Implementation' and/or device 'xc7a35t'
INFO: [DRC 23-27] Running DRC with 2 threads
INFO: [Vivado_Tcl 4-198] DRC finished with 0 Errors
INFO: [Vivado_Tcl 4-199] Please refer to the DRC report (report_drc) for more information.
Running DRC as a precondition to command place_design
INFO: [DRC 23-27] Running DRC with 2 threads
INFO: [Vivado_Tcl 4-198] DRC finished with 0 Errors
INFO: [Vivado_Tcl 4-199] Please refer to the DRC report (report_drc) for more information.

Starting Placer Task
INFO: [Place 30-611] Multithreading enabled for place_design using a maximum of 2 CPUs

Phase 1 Placer Initialization

Phase 1.1 Placer Initialization Netlist Sorting
Netlist sorting complete. Time (s): cpu = 00:00:00 ; elapsed = 00:00:00 . Memory (MB): peak = 3374.648 ; gain = 0.000
Phase 1.1 Placer Initialization Netlist Sorting | Checksum: 5876d06e

Time (s): cpu = 00:00:00 ; elapsed = 00:00:00.002 . Memory (MB): peak = 3374.648 ; gain = 0.000
Netlist sorting complete. Time (s): cpu = 00:00:00 ; elapsed = 00:00:00.001 . Memory (MB): peak = 3374.648 ; gain = 0.000

Phase 1.2 IO Placement/ Clock Placement/ Build Placer Device
INFO: [Timing 38-35] Done setting XDC timing constraints.
Phase 1.2 IO Placement/ Clock Placement/ Build Placer Device | Checksum: 17296e32f

Time (s): cpu = 00:00:01 ; elapsed = 00:00:00.096 . Memory (MB): peak = 3374.648 ; gain = 0.000

Phase 1.3 Build Placer Netlist Model
Phase 1.3 Build Placer Netlist Model | Checksum: 226d2a3dd

Time (s): cpu = 00:00:01 ; elapsed = 00:00:00.147 . Memory (MB): peak = 3374.648 ; gain = 0.000

Phase 1.4 Constrain Clocks/Macros
Phase 1.4 Constrain Clocks/Macros | Checksum: 226d2a3dd

Time (s): cpu = 00:00:01 ; elapsed = 00:00:00.148 . Memory (MB): peak = 3374.648 ; gain = 0.000
Phase 1 Placer Initialization | Checksum: 226d2a3dd

Time (s): cpu = 00:00:01 ; elapsed = 00:00:00.149 . Memory (MB): peak = 3374.648 ; gain = 0.000

Phase 2 Global Placement

Phase 2.1 Floorplanning
Phase 2.1 Floorplanning | Checksum: 20c08763f

Time (s): cpu = 00:00:01 ; elapsed = 00:00:00.192 . Memory (MB): peak = 3374.648 ; gain = 0.000

Phase 2.2 Update Timing before SLR Path Opt
Phase 2.2 Update Timing before SLR Path Opt | Checksum: 1d5b4c37d

Time (s): cpu = 00:00:01 ; elapsed = 00:00:00.215 . Memory (MB): peak = 3374.648 ; gain = 0.000

Phase 2.3 Post-Processing in Floorplanning
Phase 2.3 Post-Processing in Floorplanning | Checksum: 1d5b4c37d

Time (s): cpu = 00:00:01 ; elapsed = 00:00:00.215 . Memory (MB): peak = 3374.648 ; gain = 0.000

Phase 2.4 Global Placement Core

Phase 2.4.1 UpdateTiming Before Physical Synthesis
Phase 2.4.1 UpdateTiming Before Physical Synthesis | Checksum: 1884ebc4d

Time (s): cpu = 00:00:01 ; elapsed = 00:00:00.463 . Memory (MB): peak = 3374.648 ; gain = 0.000

Phase 2.4.2 Physical Synthesis In Placer
INFO: [Physopt 32-1035] Found 0 LUTNM shape to break, 5 LUT instances to create LUTNM shape
INFO: [Physopt 32-1044] Break lutnm for timing: one critical 0, two critical 0, total 0, new lutff created 0
INFO: [Physopt 32-1138] End 1 Pass. Optimized 2 nets or LUTs. Breaked 0 LUT, combined 2 existing LUTs and moved 0 existing LUT
INFO: [Physopt 32-65] No nets found for high-fanout optimization.
INFO: [Physopt 32-232] Optimized 0 net. Created 0 new instance.
INFO: [Physopt 32-775] End 1 Pass. Optimized 0 net or cell. Created 0 new cell, deleted 0 existing cell and moved 0 existing cell
INFO: [Physopt 32-670] No setup violation found.  DSP Register Optimization was not performed.
INFO: [Physopt 32-670] No setup violation found.  Shift Register to Pipeline Optimization was not performed.
INFO: [Physopt 32-670] No setup violation found.  Shift Register Optimization was not performed.
INFO: [Physopt 32-670] No setup violation found.  BRAM Register Optimization was not performed.
INFO: [Physopt 32-670] No setup violation found.  URAM Register Optimization was not performed.
INFO: [Physopt 32-949] No candidate nets found for dynamic/static region interface net replication
INFO: [Physopt 32-775] End 1 Pass. Optimized 0 net or cell. Created 0 new cell, deleted 0 existing cell and moved 0 existing cell
Netlist sorting complete. Time (s): cpu = 00:00:00 ; elapsed = 00:00:00 . Memory (MB): peak = 3374.648 ; gain = 0.000

Summary of Physical Synthesis Optimizations
============================================


-----------------------------------------------------------------------------------------------------------------------------------------------------------
|  Optimization                                     |  Added Cells  |  Removed Cells  |  Optimized Cells/Nets  |  Dont Touch  |  Iterations  |  Elapsed   |
-----------------------------------------------------------------------------------------------------------------------------------------------------------
|  LUT Combining                                    |            0  |              2  |                     2  |           0  |           1  |  00:00:00  |
|  Retime                                           |            0  |              0  |                     0  |           0  |           1  |  00:00:00  |
|  Very High Fanout                                 |            0  |              0  |                     0  |           0  |           1  |  00:00:00  |
|  DSP Register                                     |            0  |              0  |                     0  |           0  |           0  |  00:00:00  |
|  Shift Register to Pipeline                       |            0  |              0  |                     0  |           0  |           0  |  00:00:00  |
|  Shift Register                                   |            0  |              0  |                     0  |           0  |           0  |  00:00:00  |
|  BRAM Register                                    |            0  |              0  |                     0  |           0  |           0  |  00:00:00  |
|  URAM Register                                    |            0  |              0  |                     0  |           0  |           0  |  00:00:00  |
|  Dynamic/Static Region Interface Net Replication  |            0  |              0  |                     0  |           0  |           1  |  00:00:00  |
|  Total                                            |            0  |              2  |                     2  |           0  |           4  |  00:00:00  |
-----------------------------------------------------------------------------------------------------------------------------------------------------------


Phase 2.4.2 Physical Synthesis In Placer | Checksum: 2033de267

Time (s): cpu = 00:00:01 ; elapsed = 00:00:00.499 . Memory (MB): peak = 3374.648 ; gain = 0.000
Phase 2.4 Global Placement Core | Checksum: 1e0bf86bf

Time (s): cpu = 00:00:01 ; elapsed = 00:00:00.513 . Memory (MB): peak = 3374.648 ; gain = 0.000
Phase 2 Global Placement | Checksum: 1e0bf86bf

Time (s): cpu = 00:00:01 ; elapsed = 00:00:00.514 . Memory (MB): peak = 3374.648 ; gain = 0.000

Phase 3 Detail Placement

Phase 3.1 Commit Multi Column Macros
Phase 3.1 Commit Multi Column Macros | Checksum: 212d4f7c4

Time (s): cpu = 00:00:01 ; elapsed = 00:00:00.537 . Memory (MB): peak = 3374.648 ; gain = 0.000

Phase 3.2 Commit Most Macros & LUTRAMs
Phase 3.2 Commit Most Macros & LUTRAMs | Checksum: 1fbd86b6f

Time (s): cpu = 00:00:01 ; elapsed = 00:00:00.579 . Memory (MB): peak = 3374.648 ; gain = 0.000

Phase 3.3 Area Swap Optimization
Phase 3.3 Area Swap Optimization | Checksum: 195c0fbf6

Time (s): cpu = 00:00:01 ; elapsed = 00:00:00.581 . Memory (MB): peak = 3374.648 ; gain = 0.000

Phase 3.4 Pipeline Register Optimization
Phase 3.4 Pipeline Register Optimization | Checksum: 21b1f75dd

Time (s): cpu = 00:00:01 ; elapsed = 00:00:00.582 . Memory (MB): peak = 3374.648 ; gain = 0.000

Phase 3.5 Small Shape Detail Placement
Phase 3.5 Small Shape Detail Placement | Checksum: 1ba177db5

Time (s): cpu = 00:00:01 ; elapsed = 00:00:00.634 . Memory (MB): peak = 3374.648 ; gain = 0.000

Phase 3.6 Re-assign LUT pins
Phase 3.6 Re-assign LUT pins | Checksum: 269462a06

Time (s): cpu = 00:00:01 ; elapsed = 00:00:00.638 . Memory (MB): peak = 3374.648 ; gain = 0.000

Phase 3.7 Pipeline Register Optimization
Phase 3.7 Pipeline Register Optimization | Checksum: 20be7b3ad

Time (s): cpu = 00:00:01 ; elapsed = 00:00:00.639 . Memory (MB): peak = 3374.648 ; gain = 0.000
Phase 3 Detail Placement | Checksum: 20be7b3ad

Time (s): cpu = 00:00:01 ; elapsed = 00:00:00.639 . Memory (MB): peak = 3374.648 ; gain = 0.000

Phase 4 Post Placement Optimization and Clean-Up

Phase 4.1 Post Commit Optimization
INFO: [Timing 38-35] Done setting XDC timing constraints.

Phase 4.1.1 Post Placement Optimization
Post Placement Optimization Initialization | Checksum: 1b7d464ef

Phase 4.1.1.1 BUFG Insertion

Starting Physical Synthesis Task

Phase 1 Physical Synthesis Initialization
INFO: [Physopt 32-721] Multithreading enabled for phys_opt_design using a maximum of 2 CPUs
INFO: [Physopt 32-619] Estimated Timing Summary | WNS=5.479 | TNS=0.000 |
Phase 1 Physical Synthesis Initialization | Checksum: 213b4b820

Time (s): cpu = 00:00:00 ; elapsed = 00:00:00.008 . Memory (MB): peak = 3374.648 ; gain = 0.000
INFO: [Place 46-56] BUFG insertion identified 0 candidate nets. Inserted BUFG: 0, Replicated BUFG Driver: 0, Skipped due to Placement/Routing Conflicts: 0, Skipped due to Timing Degradation: 0, Skipped due to netlist editing failed: 0.
Ending Physical Synthesis Task | Checksum: 213b4b820

Time (s): cpu = 00:00:00 ; elapsed = 00:00:00.009 . Memory (MB): peak = 3374.648 ; gain = 0.000
Phase 4.1.1.1 BUFG Insertion | Checksum: 1b7d464ef

Time (s): cpu = 00:00:01 ; elapsed = 00:00:00.695 . Memory (MB): peak = 3374.648 ; gain = 0.000

Phase 4.1.1.2 Post Placement Timing Optimization
INFO: [Place 30-746] Post Placement Timing Summary WNS=5.479. For the most accurate timing information please run report_timing.
Phase 4.1.1.2 Post Placement Timing Optimization | Checksum: 2192eb968

Time (s): cpu = 00:00:01 ; elapsed = 00:00:00.697 . Memory (MB): peak = 3374.648 ; gain = 0.000

Time (s): cpu = 00:00:01 ; elapsed = 00:00:00.697 . Memory (MB): peak = 3374.648 ; gain = 0.000
Phase 4.1 Post Commit Optimization | Checksum: 2192eb968

Time (s): cpu = 00:00:01 ; elapsed = 00:00:00.697 . Memory (MB): peak = 3374.648 ; gain = 0.000

Phase 4.2 Post Placement Cleanup
Phase 4.2 Post Placement Cleanup | Checksum: 2192eb968

Time (s): cpu = 00:00:01 ; elapsed = 00:00:00.699 . Memory (MB): peak = 3374.648 ; gain = 0.000

Phase 4.3 Placer Reporting

Phase 4.3.1 Print Estimated Congestion
INFO: [Place 30-612] Post-Placement Estimated Congestion 
 ____________________________________________________
|           | Global Congestion | Short Congestion  |
| Direction | Region Size       | Region Size       |
|___________|___________________|___________________|
|      North|                1x1|                1x1|
|___________|___________________|___________________|
|      South|                1x1|                1x1|
|___________|___________________|___________________|
|       East|                1x1|                1x1|
|___________|___________________|___________________|
|       West|                1x1|                1x1|
|___________|___________________|___________________|

Phase 4.3.1 Print Estimated Congestion | Checksum: 2192eb968

Time (s): cpu = 00:00:01 ; elapsed = 00:00:00.700 . Memory (MB): peak = 3374.648 ; gain = 0.000
Phase 4.3 Placer Reporting | Checksum: 2192eb968

Time (s): cpu = 00:00:01 ; elapsed = 00:00:00.700 . Memory (MB): peak = 3374.648 ; gain = 0.000

Phase 4.4 Final Placement Cleanup
Netlist sorting complete. Time (s): cpu = 00:00:00 ; elapsed = 00:00:00 . Memory (MB): peak = 3374.648 ; gain = 0.000

Time (s): cpu = 00:00:01 ; elapsed = 00:00:00.703 . Memory (MB): peak = 3374.648 ; gain = 0.000
Phase 4 Post Placement Optimization and Clean-Up | Checksum: 28d1596e4

Time (s): cpu = 00:00:01 ; elapsed = 00:00:00.703 . Memory (MB): peak = 3374.648 ; gain = 0.000
Ending Placer Task | Checksum: 1ae46ef0f

Time (s): cpu = 00:00:01 ; elapsed = 00:00:00.703 . Memory (MB): peak = 3374.648 ; gain = 0.000
INFO: [Common 17-83] Releasing license: Implementation
61 Infos, 0 Warnings, 0 Critical Warnings and 0 Errors encountered.
place_design completed successfully
INFO: [runtcl-4] Executing : report_io -file lab2_io_placed.rpt
report_io: Time (s): cpu = 00:00:00 ; elapsed = 00:00:00.026 . Memory (MB): peak = 3374.648 ; gain = 0.000
INFO: [runtcl-4] Executing : report_utilization -file lab2_utilization_placed.rpt -pb lab2_utilization_placed.pb
INFO: [runtcl-4] Executing : report_control_sets -verbose -file lab2_control_sets_placed.rpt
report_control_sets: Time (s): cpu = 00:00:00 ; elapsed = 00:00:00.001 . Memory (MB): peak = 3374.648 ; gain = 0.000
INFO: [Timing 38-480] Writing timing data to binary archive.
Writing XDEF routing.
Writing XDEF routing logical nets.
Writing XDEF routing special nets.
Write XDEF Complete: Time (s): cpu = 00:00:00 ; elapsed = 00:00:00.021 . Memory (MB): peak = 3374.648 ; gain = 0.000
INFO: [Common 17-1381] The checkpoint 'C:/Users/usuario_local/Downloads/DAS_labs/projects/lab2/lab2/lab2.runs/impl_1/lab2_placed.dcp' has been generated.
Command: phys_opt_design
Attempting to get a license for feature 'Implementation' and/or device 'xc7a35t'
INFO: [Common 17-349] Got license for feature 'Implementation' and/or device 'xc7a35t'

Starting Initial Update Timing Task

Time (s): cpu = 00:00:00 ; elapsed = 00:00:00.028 . Memory (MB): peak = 3374.648 ; gain = 0.000
INFO: [Vivado_Tcl 4-383] Design worst setup slack (WNS) is greater than or equal to 0.000 ns. Skipping all physical synthesis optimizations.
INFO: [Vivado_Tcl 4-232] No setup violation found. The netlist was not modified.
INFO: [Common 17-83] Releasing license: Implementation
70 Infos, 0 Warnings, 0 Critical Warnings and 0 Errors encountered.
phys_opt_design completed successfully
INFO: [Timing 38-480] Writing timing data to binary archive.
Writing XDEF routing.
Writing XDEF routing logical nets.
Writing XDEF routing special nets.
Write XDEF Complete: Time (s): cpu = 00:00:00 ; elapsed = 00:00:00.022 . Memory (MB): peak = 3386.598 ; gain = 11.949
INFO: [Common 17-1381] The checkpoint 'C:/Users/usuario_local/Downloads/DAS_labs/projects/lab2/lab2/lab2.runs/impl_1/lab2_physopt.dcp' has been generated.
Command: route_design
Attempting to get a license for feature 'Implementation' and/or device 'xc7a35t'
INFO: [Common 17-349] Got license for feature 'Implementation' and/or device 'xc7a35t'
Running DRC as a precondition to command route_design
INFO: [DRC 23-27] Running DRC with 2 threads
INFO: [Vivado_Tcl 4-198] DRC finished with 0 Errors
INFO: [Vivado_Tcl 4-199] Please refer to the DRC report (report_drc) for more information.


Starting Routing Task
INFO: [Route 35-254] Multithreading enabled for route_design using a maximum of 2 CPUs

Phase 1 Build RT Design
Checksum: PlaceDB: cdb2bd3b ConstDB: 0 ShapeSum: e09431d4 RouteDB: 0
Post Restoration Checksum: NetGraph: 6b3f90db | NumContArr: 5afa598e | Constraints: 190a55ad | Timing: 0
Phase 1 Build RT Design | Checksum: df444016

Time (s): cpu = 00:00:10 ; elapsed = 00:00:09 . Memory (MB): peak = 3458.906 ; gain = 59.230

Phase 2 Router Initialization

Phase 2.1 Fix Topology Constraints
Phase 2.1 Fix Topology Constraints | Checksum: df444016

Time (s): cpu = 00:00:10 ; elapsed = 00:00:09 . Memory (MB): peak = 3458.906 ; gain = 59.230

Phase 2.2 Pre Route Cleanup
Phase 2.2 Pre Route Cleanup | Checksum: df444016

Time (s): cpu = 00:00:10 ; elapsed = 00:00:09 . Memory (MB): peak = 3458.906 ; gain = 59.230
 Number of Nodes with overlaps = 0

Phase 2.3 Update Timing
Phase 2.3 Update Timing | Checksum: 25c4f953c

Time (s): cpu = 00:00:10 ; elapsed = 00:00:09 . Memory (MB): peak = 3463.559 ; gain = 63.883
INFO: [Route 35-416] Intermediate Timing Summary | WNS=5.477  | TNS=0.000  | WHS=-0.053 | THS=-0.726 |


Router Utilization Summary
  Global Vertical Routing Utilization    = 0 %
  Global Horizontal Routing Utilization  = 0 %
  Routable Net Status*
  *Does not include unroutable nets such as driverless and loadless.
  Run report_route_status for detailed report.
  Number of Failed Nets               = 215
    (Failed Nets is the sum of unrouted and partially routed nets)
  Number of Unrouted Nets             = 215
  Number of Partially Routed Nets     = 0
  Number of Node Overlaps             = 0

Phase 2 Router Initialization | Checksum: 17d6cf276

Time (s): cpu = 00:00:10 ; elapsed = 00:00:09 . Memory (MB): peak = 3463.848 ; gain = 64.172

Phase 3 Initial Routing

Phase 3.1 Global Routing
Phase 3.1 Global Routing | Checksum: 17d6cf276

Time (s): cpu = 00:00:10 ; elapsed = 00:00:09 . Memory (MB): peak = 3463.848 ; gain = 64.172
Phase 3 Initial Routing | Checksum: 1b292a356

Time (s): cpu = 00:00:10 ; elapsed = 00:00:09 . Memory (MB): peak = 3463.848 ; gain = 64.172

Phase 4 Rip-up And Reroute

Phase 4.1 Global Iteration 0
 Number of Nodes with overlaps = 3
 Number of Nodes with overlaps = 0
INFO: [Route 35-416] Intermediate Timing Summary | WNS=5.521  | TNS=0.000  | WHS=N/A    | THS=N/A    |

Phase 4.1 Global Iteration 0 | Checksum: 11f2a5b1b

Time (s): cpu = 00:00:10 ; elapsed = 00:00:09 . Memory (MB): peak = 3463.848 ; gain = 64.172

Phase 4.2 Global Iteration 1
 Number of Nodes with overlaps = 1
 Number of Nodes with overlaps = 0
INFO: [Route 35-416] Intermediate Timing Summary | WNS=5.521  | TNS=0.000  | WHS=N/A    | THS=N/A    |

Phase 4.2 Global Iteration 1 | Checksum: 1c978da92

Time (s): cpu = 00:00:10 ; elapsed = 00:00:09 . Memory (MB): peak = 3463.848 ; gain = 64.172
Phase 4 Rip-up And Reroute | Checksum: 1c978da92

Time (s): cpu = 00:00:10 ; elapsed = 00:00:09 . Memory (MB): peak = 3463.848 ; gain = 64.172

Phase 5 Delay and Skew Optimization

Phase 5.1 Delay CleanUp
Phase 5.1 Delay CleanUp | Checksum: 1c978da92

Time (s): cpu = 00:00:10 ; elapsed = 00:00:09 . Memory (MB): peak = 3463.848 ; gain = 64.172

Phase 5.2 Clock Skew Optimization
Phase 5.2 Clock Skew Optimization | Checksum: 1c978da92

Time (s): cpu = 00:00:10 ; elapsed = 00:00:09 . Memory (MB): peak = 3463.848 ; gain = 64.172
Phase 5 Delay and Skew Optimization | Checksum: 1c978da92

Time (s): cpu = 00:00:10 ; elapsed = 00:00:09 . Memory (MB): peak = 3463.848 ; gain = 64.172

Phase 6 Post Hold Fix

Phase 6.1 Hold Fix Iter

Phase 6.1.1 Update Timing
Phase 6.1.1 Update Timing | Checksum: 1e1b424e4

Time (s): cpu = 00:00:10 ; elapsed = 00:00:09 . Memory (MB): peak = 3463.848 ; gain = 64.172
INFO: [Route 35-416] Intermediate Timing Summary | WNS=5.615  | TNS=0.000  | WHS=0.206  | THS=0.000  |

Phase 6.1 Hold Fix Iter | Checksum: 27e354070

Time (s): cpu = 00:00:10 ; elapsed = 00:00:09 . Memory (MB): peak = 3463.848 ; gain = 64.172
Phase 6 Post Hold Fix | Checksum: 27e354070

Time (s): cpu = 00:00:10 ; elapsed = 00:00:09 . Memory (MB): peak = 3463.848 ; gain = 64.172

Phase 7 Route finalize

Router Utilization Summary
  Global Vertical Routing Utilization    = 0.0741449 %
  Global Horizontal Routing Utilization  = 0.0671525 %
  Routable Net Status*
  *Does not include unroutable nets such as driverless and loadless.
  Run report_route_status for detailed report.
  Number of Failed Nets               = 0
    (Failed Nets is the sum of unrouted and partially routed nets)
  Number of Unrouted Nets             = 0
  Number of Partially Routed Nets     = 0
  Number of Node Overlaps             = 0

Phase 7 Route finalize | Checksum: 2233a26cb

Time (s): cpu = 00:00:10 ; elapsed = 00:00:09 . Memory (MB): peak = 3463.848 ; gain = 64.172

Phase 8 Verifying routed nets

 Verification completed successfully
Phase 8 Verifying routed nets | Checksum: 2233a26cb

Time (s): cpu = 00:00:10 ; elapsed = 00:00:09 . Memory (MB): peak = 3464.512 ; gain = 64.836

Phase 9 Depositing Routes
Phase 9 Depositing Routes | Checksum: 1eb2b80dd

Time (s): cpu = 00:00:10 ; elapsed = 00:00:09 . Memory (MB): peak = 3464.512 ; gain = 64.836

Phase 10 Post Router Timing
INFO: [Route 35-57] Estimated Timing Summary | WNS=5.615  | TNS=0.000  | WHS=0.206  | THS=0.000  |

INFO: [Route 35-327] The final timing numbers are based on the router estimated timing analysis. For a complete and accurate timing signoff, please run report_timing_summary.
Phase 10 Post Router Timing | Checksum: 1eb2b80dd

Time (s): cpu = 00:00:10 ; elapsed = 00:00:09 . Memory (MB): peak = 3464.512 ; gain = 64.836
INFO: [Route 35-16] Router Completed Successfully

Phase 11 Post-Route Event Processing
Phase 11 Post-Route Event Processing | Checksum: 18169774d

Time (s): cpu = 00:00:10 ; elapsed = 00:00:09 . Memory (MB): peak = 3464.512 ; gain = 64.836

Time (s): cpu = 00:00:10 ; elapsed = 00:00:09 . Memory (MB): peak = 3464.512 ; gain = 64.836

Routing Is Done.
INFO: [Common 17-83] Releasing license: Implementation
85 Infos, 0 Warnings, 0 Critical Warnings and 0 Errors encountered.
route_design completed successfully
route_design: Time (s): cpu = 00:00:10 ; elapsed = 00:00:15 . Memory (MB): peak = 3464.512 ; gain = 77.914
INFO: [runtcl-4] Executing : report_drc -file lab2_drc_routed.rpt -pb lab2_drc_routed.pb -rpx lab2_drc_routed.rpx
Command: report_drc -file lab2_drc_routed.rpt -pb lab2_drc_routed.pb -rpx lab2_drc_routed.rpx
INFO: [IP_Flow 19-1839] IP Catalog is up to date.
INFO: [DRC 23-27] Running DRC with 2 threads
INFO: [Vivado_Tcl 2-168] The results of DRC are in file C:/Users/usuario_local/Downloads/DAS_labs/projects/lab2/lab2/lab2.runs/impl_1/lab2_drc_routed.rpt.
report_drc completed successfully
INFO: [runtcl-4] Executing : report_methodology -file lab2_methodology_drc_routed.rpt -pb lab2_methodology_drc_routed.pb -rpx lab2_methodology_drc_routed.rpx
Command: report_methodology -file lab2_methodology_drc_routed.rpt -pb lab2_methodology_drc_routed.pb -rpx lab2_methodology_drc_routed.rpx
INFO: [Timing 38-35] Done setting XDC timing constraints.
INFO: [DRC 23-133] Running Methodology with 2 threads
INFO: [Vivado_Tcl 2-1520] The results of Report Methodology are in file C:/Users/usuario_local/Downloads/DAS_labs/projects/lab2/lab2/lab2.runs/impl_1/lab2_methodology_drc_routed.rpt.
report_methodology completed successfully
INFO: [runtcl-4] Executing : report_power -file lab2_power_routed.rpt -pb lab2_power_summary_routed.pb -rpx lab2_power_routed.rpx
Command: report_power -file lab2_power_routed.rpt -pb lab2_power_summary_routed.pb -rpx lab2_power_routed.rpx
INFO: [Timing 38-35] Done setting XDC timing constraints.
Running Vector-less Activity Propagation...

Finished Running Vector-less Activity Propagation
95 Infos, 0 Warnings, 0 Critical Warnings and 0 Errors encountered.
report_power completed successfully
INFO: [runtcl-4] Executing : report_route_status -file lab2_route_status.rpt -pb lab2_route_status.pb
INFO: [runtcl-4] Executing : report_timing_summary -max_paths 10 -report_unconstrained -file lab2_timing_summary_routed.rpt -pb lab2_timing_summary_routed.pb -rpx lab2_timing_summary_routed.rpx -warn_on_violation 
INFO: [Timing 38-91] UpdateTimingParams: Speed grade: -1, Delay Type: min_max.
INFO: [Timing 38-191] Multithreading enabled for timing update using a maximum of 2 CPUs
INFO: [runtcl-4] Executing : report_incremental_reuse -file lab2_incremental_reuse_routed.rpt
INFO: [Vivado_Tcl 4-1062] Incremental flow is disabled. No incremental reuse Info to report.
INFO: [runtcl-4] Executing : report_clock_utilization -file lab2_clock_utilization_routed.rpt
INFO: [runtcl-4] Executing : report_bus_skew -warn_on_violation -file lab2_bus_skew_routed.rpt -pb lab2_bus_skew_routed.pb -rpx lab2_bus_skew_routed.rpx
INFO: [Timing 38-91] UpdateTimingParams: Speed grade: -1, Delay Type: min_max.
INFO: [Timing 38-191] Multithreading enabled for timing update using a maximum of 2 CPUs
INFO: [Timing 38-480] Writing timing data to binary archive.
Writing XDEF routing.
Writing XDEF routing logical nets.
Writing XDEF routing special nets.
Write XDEF Complete: Time (s): cpu = 00:00:00 ; elapsed = 00:00:00.024 . Memory (MB): peak = 3510.570 ; gain = 5.156
INFO: [Common 17-1381] The checkpoint 'C:/Users/usuario_local/Downloads/DAS_labs/projects/lab2/lab2/lab2.runs/impl_1/lab2_routed.dcp' has been generated.
INFO: [Common 17-206] Exiting Vivado at Fri Feb 13 15:49:26 2026...

*** Running vivado
    with args -log lab2.vdi -applog -m64 -product Vivado -messageDb vivado.pb -mode batch -source lab2.tcl -notrace



****** Vivado v2023.1 (64-bit)
  **** SW Build 3865809 on Sun May  7 15:05:29 MDT 2023
  **** IP Build 3864474 on Sun May  7 20:36:21 MDT 2023
  **** SharedData Build 3865790 on Sun May 07 13:33:03 MDT 2023
    ** Copyright 1986-2022 Xilinx, Inc. All Rights Reserved.
    ** Copyright 2022-2023 Advanced Micro Devices, Inc. All Rights Reserved.

source lab2.tcl -notrace
Command: open_checkpoint lab2_routed.dcp
INFO: [Device 21-403] Loading part xc7a35tcpg236-1
Netlist sorting complete. Time (s): cpu = 00:00:00 ; elapsed = 00:00:00.001 . Memory (MB): peak = 2313.590 ; gain = 0.000
INFO: [Netlist 29-17] Analyzing 18 Unisim elements for replacement
INFO: [Netlist 29-28] Unisim Transformation completed in 0 CPU seconds
INFO: [Project 1-479] Netlist was created with Vivado 2023.1
INFO: [Project 1-570] Preparing netlist for logic optimization
INFO: [Timing 38-478] Restoring timing data from binary archive.
INFO: [Timing 38-479] Binary timing data restore complete.
INFO: [Project 1-856] Restoring constraints from binary archive.
INFO: [Project 1-853] Binary constraint restore complete.
Reading XDEF placement.
Reading placer database...
Reading XDEF routing.
Read XDEF Files: Time (s): cpu = 00:00:00 ; elapsed = 00:00:00.052 . Memory (MB): peak = 3015.566 ; gain = 7.148
Restored from archive | CPU: 0.000000 secs | Memory: 0.000000 MB |
Finished XDEF File Restore: Time (s): cpu = 00:00:00 ; elapsed = 00:00:00.052 . Memory (MB): peak = 3015.566 ; gain = 7.148
Netlist sorting complete. Time (s): cpu = 00:00:00 ; elapsed = 00:00:00 . Memory (MB): peak = 3015.566 ; gain = 0.000
INFO: [Project 1-111] Unisim Transformation Summary:
No Unisim elements were transformed.

INFO: [Project 1-604] Checkpoint was created with Vivado v2023.1 (64-bit) build 3865809
open_checkpoint: Time (s): cpu = 00:00:12 ; elapsed = 00:00:24 . Memory (MB): peak = 3015.566 ; gain = 1272.250
Command: write_bitstream -force lab2.bit
Attempting to get a license for feature 'Implementation' and/or device 'xc7a35t'
INFO: [Common 17-349] Got license for feature 'Implementation' and/or device 'xc7a35t'
Running DRC as a precondition to command write_bitstream
INFO: [IP_Flow 19-234] Refreshing IP repositories
INFO: [IP_Flow 19-1704] No user IP repositories specified
INFO: [IP_Flow 19-2313] Loaded Vivado IP repository 'C:/software/electronica/xilinx/Vivado/2023.1/data/ip'.
INFO: [DRC 23-27] Running DRC with 2 threads
INFO: [Vivado 12-3199] DRC finished with 0 Errors
INFO: [Vivado 12-3200] Please refer to the DRC report (report_drc) for more information.
INFO: [Designutils 20-2272] Running write_bitstream with 2 threads.
Loading data files...
Loading site data...
Loading route data...
Processing options...
Creating bitmap...
Creating bitstream...
Writing bitstream ./lab2.bit...
INFO: [Vivado 12-1842] Bitgen Completed Successfully.
INFO: [Common 17-83] Releasing license: Implementation
21 Infos, 0 Warnings, 0 Critical Warnings and 0 Errors encountered.
write_bitstream completed successfully
write_bitstream: Time (s): cpu = 00:00:06 ; elapsed = 00:00:18 . Memory (MB): peak = 3578.629 ; gain = 563.062
INFO: [Common 17-206] Exiting Vivado at Fri Feb 13 15:51:13 2026...
